<?xml version="1.0"?>
<!--
To change this license header, choose License Headers in Project Properties.
To change this template file, choose Tools | Templates
and open the template in the editor.
-->


<xs:schema    xmlns:xs="http://www.w3.org/2001/XMLSchema"
              targetNamespace="http://www.w3schools.com"

              elementFormDefault="qualified">
  <xs:element name="root">
    <xs:complexType mixed="true">
      <xs:sequence maxOccurs="unbounded">
        <xs:element name="users">
          <xs:complexType>
            <xs:sequence maxOccurs="unbounded">
              <xs:element name="user">
                <xs:complexType mixed="true">
                  <xs:sequence>
                    <xs:element name="fullName" type="xs:string"/> 
                    <xs:element name="sex" type="xs:string"/> 
                    <xs:element name="age" type="xs:string"/> 
                    <xs:element name="phoneNo" type="xs:string"/>
                    <xs:element name="address" type="xs:string"/> 
                    <xs:element name ="title" type="xs:string"/>
                  </xs:sequence>
                  <xs:attribute name="code" type="xs:string"/>
                </xs:complexType>
              </xs:element> <!-- name -->
            </xs:sequence>
          </xs:complexType>
        </xs:element>
      </xs:sequence>
    </xs:complexType>
  </xs:element>
</xs:schema>